{
  "scanner_version": "1.0.0",
  "meta": {
    "report_id": "PATH-CONSUMER-20260410T184328Z",
    "generated_at": "2026-04-10T18:43:28Z",
    "generator_version": "1.0.0",
    "content_hash": "f4572c3cbe5e787567cdab5b8b7b64759655b7bddd1322fd344398a954e56073",
    "role": "CONSUMER",
    "scan_date": "2026-04-10"
  },
  "pathway_config": {
    "role": "CONSUMER",
    "checkpoint_count": 8,
    "checkpoint_definitions": [
      {
        "checkpoint_id": "C-DISCOVERY",
        "checkpoint_name": "Discovery Protocol",
        "order": 1,
        "depends_on": [],
        "protocol": "pf-discovery-protocol",
        "description": "Locate and register with available signal producers via discovery protocol"
      },
      {
        "checkpoint_id": "C-SCHEMA",
        "checkpoint_name": "Schema Compliance",
        "order": 2,
        "depends_on": [
          "C-DISCOVERY"
        ],
        "protocol": "pf-signal-schema",
        "description": "Validate that discovered producer signals conform to canonical signal schema"
      },
      {
        "checkpoint_id": "C-ROUTING",
        "checkpoint_name": "Routing Configuration",
        "order": 3,
        "depends_on": [
          "C-SCHEMA"
        ],
        "protocol": "pf-routing-protocol",
        "description": "Configure signal routing with preflight filters, VOI gates, and duration limits"
      },
      {
        "checkpoint_id": "C-TRUST",
        "checkpoint_name": "Trust Evaluation",
        "order": 4,
        "depends_on": [
          "C-ROUTING"
        ],
        "protocol": "pf-trust-gateway",
        "description": "Evaluate producer trustworthiness across 5 dimensions before consuming signals"
      },
      {
        "checkpoint_id": "C-ACCEPTANCE",
        "checkpoint_name": "Acceptance Testing",
        "order": 5,
        "depends_on": [
          "C-TRUST"
        ],
        "protocol": "pf-acceptance-test",
        "description": "Run 7-check acceptance test to validate integration readiness"
      },
      {
        "checkpoint_id": "C-CONSUMPTION",
        "checkpoint_name": "Signal Consumption",
        "order": 6,
        "depends_on": [
          "C-ACCEPTANCE"
        ],
        "protocol": "pf-consumer-activity-feed",
        "description": "Begin consuming signals and generating activity feed with run tracking"
      },
      {
        "checkpoint_id": "C-VERIFICATION",
        "checkpoint_name": "Consumption Verification",
        "order": 7,
        "depends_on": [
          "C-CONSUMPTION"
        ],
        "protocol": "pf-consumer-verification",
        "description": "Verify consumption with replay runner and dated attestation"
      },
      {
        "checkpoint_id": "C-MONITORING",
        "checkpoint_name": "Health Monitoring",
        "order": 8,
        "depends_on": [
          "C-VERIFICATION"
        ],
        "protocol": "pf-health-monitor",
        "description": "Establish ongoing health monitoring with 6-dimension scoring and alerting"
      }
    ]
  },
  "checkpoints": [
    {
      "checkpoint_id": "C-DISCOVERY",
      "checkpoint_name": "Discovery Protocol",
      "order": 1,
      "status": "COMPLETED",
      "validation": {
        "checks_run": 5,
        "checks_passed": 5,
        "checks_failed": 0,
        "pass_rate": 1.0,
        "details": [
          {
            "check_name": "artifact_exists",
            "passed": true,
            "detail": "Discovery result artifact found"
          },
          {
            "check_name": "is_dict",
            "passed": true,
            "detail": "Discovery result is a dict"
          },
          {
            "check_name": "has_producers",
            "passed": true,
            "detail": "Found 1 producer(s)"
          },
          {
            "check_name": "has_version",
            "passed": true,
            "detail": "Version field present"
          },
          {
            "check_name": "has_timestamp",
            "passed": true,
            "detail": "Timestamp field present"
          }
        ]
      },
      "depends_on": [],
      "blocked_by": []
    },
    {
      "checkpoint_id": "C-SCHEMA",
      "checkpoint_name": "Schema Compliance",
      "order": 2,
      "status": "COMPLETED",
      "validation": {
        "checks_run": 8,
        "checks_passed": 8,
        "checks_failed": 0,
        "pass_rate": 1.0,
        "details": [
          {
            "check_name": "artifact_exists",
            "passed": true,
            "detail": "Signal sample artifact found"
          },
          {
            "check_name": "has_signals",
            "passed": true,
            "detail": "Found 30 signal(s)"
          },
          {
            "check_name": "signal_has_signal_id",
            "passed": true,
            "detail": "Signal has signal_id"
          },
          {
            "check_name": "signal_has_symbol",
            "passed": true,
            "detail": "Signal has symbol"
          },
          {
            "check_name": "signal_has_direction",
            "passed": true,
            "detail": "Signal has direction"
          },
          {
            "check_name": "signal_has_confidence",
            "passed": true,
            "detail": "Signal has confidence"
          },
          {
            "check_name": "direction_valid",
            "passed": true,
            "detail": "Direction 'bullish' is valid"
          },
          {
            "check_name": "confidence_bounds",
            "passed": true,
            "detail": "Confidence 0.62 in [0,1]"
          }
        ]
      },
      "depends_on": [
        "C-DISCOVERY"
      ],
      "blocked_by": []
    },
    {
      "checkpoint_id": "C-ROUTING",
      "checkpoint_name": "Routing Configuration",
      "order": 3,
      "status": "COMPLETED",
      "validation": {
        "checks_run": 5,
        "checks_passed": 5,
        "checks_failed": 0,
        "pass_rate": 1.0,
        "details": [
          {
            "check_name": "signal_sample_exists",
            "passed": true,
            "detail": "Signal sample available for routing validation"
          },
          {
            "check_name": "has_horizon",
            "passed": true,
            "detail": "Horizon/duration field present"
          },
          {
            "check_name": "has_symbol",
            "passed": true,
            "detail": "Symbol field present for routing"
          },
          {
            "check_name": "has_confidence",
            "passed": true,
            "detail": "Confidence field present for VOI gate"
          },
          {
            "check_name": "has_regime",
            "passed": true,
            "detail": "Regime field present for routing decisions"
          }
        ]
      },
      "depends_on": [
        "C-SCHEMA"
      ],
      "blocked_by": []
    },
    {
      "checkpoint_id": "C-TRUST",
      "checkpoint_name": "Trust Evaluation",
      "order": 4,
      "status": "COMPLETED",
      "validation": {
        "checks_run": 5,
        "checks_passed": 5,
        "checks_failed": 0,
        "pass_rate": 1.0,
        "details": [
          {
            "check_name": "artifact_exists",
            "passed": true,
            "detail": "Trust evaluation artifact found"
          },
          {
            "check_name": "is_dict",
            "passed": true,
            "detail": "Trust evaluation is a dict"
          },
          {
            "check_name": "has_verdict",
            "passed": true,
            "detail": "Trust verdict present: {'recommendation': 'ADOPT_WITH_CAVEATS', 'confidence': 1, 'composite_trust_score': 0.624588, 'grade': 'C', 'rationale': 'Composite trust score: 62.5% (Grade C). Strengths: operational health, schema compliance, consumption track record. Weaknesses: proof integrity. Producer is usable with noted caveats. Review risk factors before integrating.', 'dimension_scores': {'operational_health': {'score': 0.722312, 'grade': 'B', 'weight': 0.25, 'source_field': 'health_report.composite.score', 'detail': 'Composite health 72.2%, all gates pass.'}, 'proof_integrity': {'score': 0.149539, 'grade': 'F', 'weight': 0.25, 'source_field': 'proof_surface.overall.brier_decomposition', 'detail': 'Accuracy 51.5%, Brier 0.2481, 2128 resolved, reputation 0.5556.'}, 'schema_compliance': {'score': 1.0, 'grade': 'A', 'weight': 0.15, 'source_field': 'health_report.dimensions.schema_conformance.score', 'detail': 'Schema conformance 100.0%.'}, 'consumption_track_record': {'score': 0.8425, 'grade': 'B', 'weight': 0.2, 'source_field': 'activity_feed.aggregate+attestation', 'detail': '1 consumer(s), 8295 signals, 23d span, 100% uptime; attestation present (age 104h)'}, 'artifact_currency': {'score': 0.5875, 'grade': 'C', 'weight': 0.15, 'source_field': 'all_artifacts.generated_at', 'detail': 'health_report: LIVE (1h); proof_surface: EXPIRED (362h); activity_feed: RECENT (2h); attestation: STALE (104h)'}}, 'verdict_thresholds': {'ADOPT': 0.75, 'ADOPT_WITH_CAVEATS': 0.55, 'WAIT': 0.35, 'AVOID': 0.0}, 'blocking_factors': None}"
          },
          {
            "check_name": "verdict_valid",
            "passed": true,
            "detail": "Verdict 'ADOPT_WITH_CAVEATS' is valid"
          },
          {
            "check_name": "has_dimensions",
            "passed": true,
            "detail": "Trust dimensions present"
          }
        ]
      },
      "depends_on": [
        "C-ROUTING"
      ],
      "blocked_by": []
    },
    {
      "checkpoint_id": "C-ACCEPTANCE",
      "checkpoint_name": "Acceptance Testing",
      "order": 5,
      "status": "COMPLETED",
      "validation": {
        "checks_run": 6,
        "checks_passed": 6,
        "checks_failed": 0,
        "pass_rate": 1.0,
        "details": [
          {
            "check_name": "artifact_exists",
            "passed": true,
            "detail": "Acceptance report artifact found"
          },
          {
            "check_name": "is_dict",